{
    "$schema": "../schema/registry-item.schema.json",
    "name": "ai",
    "title": "AI",
    "description": "Workers AI for Lunora \u2014 bring LLMs to your functions with `ctx.ai`, powered by @lunora/ai (Vercel AI SDK over Cloudflare Workers AI). Scaffolds a summarise action and a sentiment analysis action as examples.",
    "docs": "After installing, add the `AI` binding to your `wrangler.jsonc` (the registry item adds it for you). Then run `lunora codegen` to wire `ctx.ai` onto ActionCtx. The shipped `summarize` and `analyzeSentiment` actions surface in the generated `api` as `ai/summarize` and `ai/analyzeSentiment` \u2014 edit them or use them as templates for your own AI actions. Both fail closed on purpose: Workers AI is metered and Lunora actions are public RPC, so they require an authenticated caller, rate-limit per caller (keyed ctx.auth.userId ?? ctx.ip), and bound the prompt length. Widen those bounds deliberately; removing them makes the endpoint an anonymous way to spend your neuron budget. The `@lunora/ai` package re-exports helpers from the Vercel AI SDK (`generateText`, `streamText`, `embed`, tool`, etc.), so you can build agentic flows directly.",
    "requires": [],
    "deps": {
        "@lunora/ai": "workspace:*",
        "@lunora/errors": "workspace:*",
        "@lunora/ratelimit": "workspace:*",
        "@lunora/server": "workspace:*"
    },
    "bindings": [
        {
            "path": ["ai"],
            "value": {
                "binding": "AI"
            }
        }
    ],
    "files": [
        {
            "from": "ai.ts",
            "to": "lunora/ai/index.ts",
            "merge": "create-or-skip"
        }
    ]
}
