{
    "$schema": "../schema/registry-item.schema.json",
    "name": "auth-clerk-jwt",
    "title": "Auth — Clerk sessions (bring your own auth)",
    "description": "Use Clerk as the identity provider and let Clerk own the session: verify each request's Clerk session token against your instance's JWKS and feed the user, active organization, role and permissions into ctx.auth / RLS via a resolveIdentity adapter. For Clerk as a login button on a Lunora-owned better-auth session, use auth-clerk instead.",
    "docs": "Pass `clerkIdentity(env)` as `resolveIdentity` in your Worker entry (`createWorker({ resolveIdentity: clerkIdentity(env), … })`, or `.extend((env) => ({ resolveIdentity: clerkIdentity(env) }))` on the generated app builder). On the client, create the LunoraClient with `authTokenOnUpgrade: true`, call `setAuthToken(await getToken())` after sign-in, and refresh it in `onTokenExpired`. Guide: https://lunora.sh/docs/concepts/external-auth",
    "requires": [],
    "deps": {
        "@lunora/jwt-auth": "workspace:*"
    },
    "envVars": [
        {
            "name": "CLERK_PUBLISHABLE_KEY",
            "description": "Your Clerk publishable key (pk_test_… / pk_live_…). Not a secret — the same key the frontend uses; it encodes the Frontend API that issues session tokens.",
            "value": "pk_test_replace-me",
            "secret": false
        },
        {
            "name": "CLERK_AUTHORIZED_PARTIES",
            "description": "Comma-separated origins of your frontend (checked against the token's azp claim), e.g. http://localhost:5173,https://app.example.com.",
            "value": "http://localhost:5173",
            "secret": false
        }
    ],
    "files": [{ "from": "clerk.ts", "to": "lunora/identity/clerk.ts", "merge": "create-or-skip" }]
}
