{
    "$schema": "../schema/registry-item.schema.json",
    "name": "saas-ui-svelte",
    "title": "SaaS UI — Svelte",
    "description": "Copy-in, user-owned Svelte screens for the Lunora SaaS kit: the dashboard stat row, the project list with its create form and search/sort toolbar, the activity feed grouped by day, and the platform admin's organization table. Framework-agnostic view model under lunora/saas-ui/core, thin Svelte views under lunora/saas-ui/svelte, and token-aligned CSS — no Tailwind, no component library. Edit anything; upgrades are 3-way merged.",
    "docs": "Import the stylesheet once and render the cards from your dashboard route: `import { OverviewStats, ProjectsCard } from './lunora/saas-ui/svelte'; import './lunora/saas-ui/styles.css';`. Nothing here subscribes — the route owns the query, because the wiring differs per meta-framework. Pass `query(api.saas.overview, {}, { shardKey: organizationId })` straight into `payload`, `Date.now()` into `now`, and your mutations, called with the same `shardKey`, into `onCreate`/`onArchive` — the `saas` functions run only on the organization's own shard. Requires the `saas` server item (auto-added). For sign-in and organization screens, add the matching `auth-ui-svelte` item.",
    "requires": ["saas"],
    "deps": {},
    "files": [
        { "from": "core/activity.ts", "merge": "create-or-skip", "to": "lunora/saas-ui/core/activity.ts" },
        { "from": "core/admin-organizations.ts", "merge": "create-or-skip", "to": "lunora/saas-ui/core/admin-organizations.ts" },
        { "from": "core/billing.ts", "merge": "create-or-skip", "to": "lunora/saas-ui/core/billing.ts" },
        { "from": "core/create-form-controller.ts", "merge": "create-or-skip", "to": "lunora/saas-ui/core/create-form-controller.ts" },
        { "from": "core/format.ts", "merge": "create-or-skip", "to": "lunora/saas-ui/core/format.ts" },
        { "from": "core/index.ts", "merge": "create-or-skip", "to": "lunora/saas-ui/core/index.ts" },
        { "from": "core/map-error.ts", "merge": "create-or-skip", "to": "lunora/saas-ui/core/map-error.ts" },
        { "from": "core/overview.ts", "merge": "create-or-skip", "to": "lunora/saas-ui/core/overview.ts" },
        { "from": "core/presence.ts", "merge": "create-or-skip", "to": "lunora/saas-ui/core/presence.ts" },
        { "from": "core/project-form.ts", "merge": "create-or-skip", "to": "lunora/saas-ui/core/project-form.ts" },
        { "from": "core/projects.ts", "merge": "create-or-skip", "to": "lunora/saas-ui/core/projects.ts" },
        { "from": "core/store.ts", "merge": "create-or-skip", "to": "lunora/saas-ui/core/store.ts" },
        { "from": "core/types.ts", "merge": "create-or-skip", "to": "lunora/saas-ui/core/types.ts" },
        { "from": "styles.css", "merge": "create-or-skip", "to": "lunora/saas-ui/styles.css" },
        { "from": "svelte/ActivityFeed.svelte", "merge": "create-or-skip", "to": "lunora/saas-ui/svelte/ActivityFeed.svelte" },
        { "from": "svelte/AdminOrganizations.svelte", "merge": "create-or-skip", "to": "lunora/saas-ui/svelte/AdminOrganizations.svelte" },
        { "from": "svelte/BillingPanel.svelte", "merge": "create-or-skip", "to": "lunora/saas-ui/svelte/BillingPanel.svelte" },
        { "from": "svelte/Card.svelte", "merge": "create-or-skip", "to": "lunora/saas-ui/svelte/Card.svelte" },
        { "from": "svelte/Empty.svelte", "merge": "create-or-skip", "to": "lunora/saas-ui/svelte/Empty.svelte" },
        { "from": "svelte/Gated.svelte", "merge": "create-or-skip", "to": "lunora/saas-ui/svelte/Gated.svelte" },
        { "from": "svelte/OverviewStats.svelte", "merge": "create-or-skip", "to": "lunora/saas-ui/svelte/OverviewStats.svelte" },
        { "from": "svelte/PresenceBar.svelte", "merge": "create-or-skip", "to": "lunora/saas-ui/svelte/PresenceBar.svelte" },
        { "from": "svelte/PricingTable.svelte", "merge": "create-or-skip", "to": "lunora/saas-ui/svelte/PricingTable.svelte" },
        { "from": "svelte/ProjectsCard.svelte", "merge": "create-or-skip", "to": "lunora/saas-ui/svelte/ProjectsCard.svelte" },
        { "from": "svelte/index.ts", "merge": "create-or-skip", "to": "lunora/saas-ui/svelte/index.ts" },
        { "from": "svelte/use-form.svelte.ts", "merge": "create-or-skip", "to": "lunora/saas-ui/svelte/use-form.svelte.ts" }
    ]
}
