{
    "$schema": "../schema/registry-item.schema.json",
    "name": "backup",
    "title": "Backup",
    "description": "Off-platform scheduled snapshots with retention — a cron-driven `snapshot` internalAction exports a configured set of tables to timestamped NDJSON in a dedicated R2 bucket, and a cron-driven `prune` internalAction ages snapshots out by retention window. Restore with `lunora backup restore <id|file>`, which imports a snapshot boundary; for in-place time-travel to an arbitrary moment use native PITR (`lunora backup pitr`). Reads through a shard-local `ctx.db`, so on a `.shardBy()` deployment it covers the default shard only.",
    "docs": "Register the snapshot+prune cron pair in lunora/crons.ts: `crons.daily(\"backup snapshot\", { hourUTC: 3, minuteUTC: 0 }, internal.backup.snapshot, {})` and `crons.daily(\"backup prune\", { hourUTC: 4, minuteUTC: 0 }, internal.backup.prune, { keepDays: 30, keepLast: 5 })`, then `lunora codegen`. Edit the TABLES list in lunora/backup/index.ts to cover every table you want backed up (codegen cannot enumerate tables for you). prune retention: keepDays and/or keepLast — a snapshot is deleted only if it's both older than keepDays and not among the keepLast newest. Add the BACKUP_BUCKET r2_buckets binding (added to wrangler.jsonc on install). Restore with `lunora backup restore <id|file>` — it imports a snapshot boundary; there is no `--to` and no changelog replay, so reach for `lunora backup pitr --at <ISO>` when you need an arbitrary moment. `snapshot` reads through a shard-local `ctx.db` and logs a warning saying so on every run: on a `.shardBy()` deployment it captures the default shard only, so use `lunora backup create --bucket` or the platform's `backupCron` for whole-deployment snapshots there.",
    "requires": [],
    "deps": {
        "@lunora/scheduler": "workspace:*",
        "@lunora/server": "workspace:*",
        "@lunora/storage": "workspace:*"
    },
    "bindings": [
        {
            "path": ["r2_buckets"],
            "value": [
                {
                    "binding": "BACKUP_BUCKET",
                    "bucket_name": "lunora-backups"
                }
            ]
        }
    ],
    "files": [{ "from": "backup.ts", "to": "lunora/backup/index.ts", "merge": "create-or-skip" }]
}
