{
    "$schema": "../schema/registry-item.schema.json",
    "name": "auth-workos",
    "title": "Auth — WorkOS AuthKit (bring your own auth)",
    "description": "Use WorkOS AuthKit as the identity provider: verify each request's AuthKit access token against your client's JWKS and feed the user, organization, role, permissions, entitlements and feature flags into ctx.auth / RLS via a resolveIdentity adapter.",
    "docs": "Pass `workosIdentity(env)` as `resolveIdentity` in your Worker entry (`createWorker({ resolveIdentity: workosIdentity(env), … })`, or `.extend((env) => ({ resolveIdentity: workosIdentity(env) }))` on the generated app builder). On the client, create the LunoraClient with `authTokenOnUpgrade: true`, call `setAuthToken(await getAccessToken())` after sign-in, and refresh it in `onTokenExpired`. Guide: https://lunora.sh/docs/concepts/external-auth",
    "requires": [],
    "deps": {
        "@lunora/jwt-auth": "workspace:*"
    },
    "envVars": [
        {
            "name": "WORKOS_CLIENT_ID",
            "description": "Your WorkOS client id (client_…), from the WorkOS dashboard's API keys page. Not a secret — the frontend uses it too.",
            "value": "client_replace-me",
            "secret": false
        }
    ],
    "files": [{ "from": "workos.ts", "to": "lunora/identity/workos.ts", "merge": "create-or-skip" }]
}
