{
    "$schema": "../schema/registry-item.schema.json",
    "name": "mail",
    "title": "Mail",
    "description": "Transactional email for Lunora — a sendEmail action (plus a fire-and-forget queueEmail) built on @lunora/mail's Cloudflare Email Workers transport, with CR/LF + header-injection-safe address handling and a dev mail catcher that surfaces every send in the studio.",
    "docs": "Default provider is Cloudflare Email Workers (the SEND_EMAIL send binding). Set up Email Routing: verify a destination address and replace the `destination_address` placeholder in wrangler.jsonc. Set MAIL_FROM in your env/.dev.vars and re-export from lunora/index.ts so codegen emits api.mail.sendEmail. In `lunora dev` every send is captured into the studio's Mail tab instead of delivered (no provider setup needed) — set LUNORA_MAIL_CAPTURE=0 to deliver in dev, or =1 to force capture. Prefer a hosted provider? Pass `apiKey` (Resend) or a custom `transport` to createMailer in lunora/mail/index.ts. queueEmail needs a Cloudflare Queue binding — see the README before enabling it.",
    "requires": [],
    "deps": {
        "@lunora/mail": "workspace:*",
        "@lunora/server": "workspace:*"
    },
    "bindings": [
        {
            "path": ["send_email"],
            "value": [{ "name": "SEND_EMAIL", "destination_address": "REPLACE_ME@example.com" }]
        }
    ],
    "envVars": [
        {
            "name": "MAIL_FROM",
            "description": "Default sender address. Use a domain you control on Cloudflare Email Routing; `Name <addr@host>` or bare `addr@host`.",
            "value": "Acme <noreply@acme.test>",
            "secret": false
        }
    ],
    "files": [{ "from": "mail.ts", "to": "lunora/mail/index.ts", "merge": "create-or-skip" }]
}
